{
  "$schema": "./catalog-template.schema.json",
  "version": "1.1.0",
  "description": "GameFrameX 文档目录骨架模板。5 语言 docs/<lang>/ 已存在，本文件锁定命名约定和 9 个一级域的目录名，并定义 components/unity 的包级子目录生成规则（childrenTemplate）。子目录不预生成，由 OpenDeepWiki 按 packageTreeRule 在摄取时展开。",
  "rootDomains": [
    "guide",
    "architecture",
    "components/unity",
    "components/server",
    "components/foundation",
    "components/godot",
    "admin",
    "data-and-config",
    "tools-and-specification"
  ],
  "namingRules": {
    "pathStyle": "lowercase-hyphen",
    "forbiddenChars": ["_", " ", "."],
    "maxSegmentLength": 64,
    "note": "目录段内禁止 . —— 包名的 . 只用于切分层级（见 packageTreeRule），不保留在目录名中"
  },
  "childrenTemplate": {
    "components/unity": {
      "source": "GitHub org GameFrameX 下 com.gameframex.unity / com.gameframex.unity.* 包仓（repo-registry.json gfx-unity-packages 组显式登记，新增包仓手动补条目；第三方重打包默认 active: false 需逐个激活）",
      "packageTreeRule": "包名剥去前缀 com.gameframex.unity 后按 . 切分，每段映射为一个目录层级，追加在 components/unity/ 之下；剥后为空（主包 com.gameframex.unity 本体）则落 components/unity/ 域根",
      "examples": [
        "com.gameframex.unity → components/unity/（主包，落域根）",
        "com.gameframex.unity.ui.fairygui → components/unity/ui/fairygui/",
        "com.gameframex.unity.payment.google → components/unity/payment/google/",
        "com.gameframex.unity.advertisement.topon → components/unity/advertisement/topon/",
        "com.gameframex.unity.tuyoogame.yooasset.minigame.wechat → components/unity/tuyoogame/yooasset/minigame/wechat/",
        "com.gameframex.unity.entity → components/unity/entity/"
      ]
    },
    "components/godot": {
      "note": "Phase 3 建仓后参照 components/unity 的 packageTreeRule 扩展（包名前缀届时定义）"
    }
  },
  "frontmatter": {
    "required": ["title", "order"],
    "autoGenerated": {
      "source.repo": "string",
      "source.commit": "sha",
      "source.generator": "string",
      "source.upstream": "string（仅第三方重打包激活时，记录上游仓，如 tuyoogame/YooAsset）"
    }
  }
}
